{
  "$schema": "https://json-schema.org/draft/2020-12/schema",
  "$id": "https://disclosure-analyst.local/schema/agent-comparison/benchmark/benchmark-comparison-report.v0.1.json",
  "title": "Benchmark Comparison Report v0.1",
  "description": "Turn P6: cross-variant report over the SAME dataset -- one BenchmarkRunResult (benchmark-run-result.schema.json) per variant, plus set-equality/config-difference/pin bookkeeping. This Turn's own schema version FIXES ranking_performed/holdout_accessed/official_gold_accessed to false via `const` -- no report produced against this exact schema_version can ever claim a ranking was computed or that HOLDOUT/official Gold was touched. A future Turn that actually needs ranking/HOLDOUT reporting must define a new schema_version, never relax this one.",
  "type": "object",
  "additionalProperties": false,
  "required": [
    "schema_version", "benchmark_run_id", "dataset_id", "dataset_sha256",
    "code_revision", "release_id", "release_manifest_sha256",
    "variant_run_results", "identical_item_set", "missing_items_by_variant",
    "model_config_differences", "ranking_performed", "holdout_accessed",
    "official_gold_accessed"
  ],
  "properties": {
    "schema_version": { "const": "0.1.0" },
    "benchmark_run_id": { "type": "string", "minLength": 1 },
    "dataset_id": { "type": "string", "minLength": 1 },
    "dataset_sha256": { "type": "string", "pattern": "^[0-9a-f]{64}$" },
    "code_revision": { "type": "string", "minLength": 1 },
    "release_id": { "type": ["string", "null"] },
    "release_manifest_sha256": { "type": ["string", "null"], "pattern": "^[0-9a-f]{64}$" },
    "variant_run_results": {
      "type": "array",
      "minItems": 1,
      "items": {
        "$ref": "https://disclosure-analyst.local/schema/agent-comparison/benchmark/benchmark-run-result.v0.1.json"
      },
      "description": "One embedded BenchmarkRunResult per variant actually compared -- never a subset re-derivation, the exact same object report.mjs already produced per variant."
    },
    "identical_item_set": {
      "type": "boolean",
      "description": "true only when every variant_run_results[].item_ids array is the exact same SET (order-independent) -- see missing_items_by_variant for the detail when false."
    },
    "missing_items_by_variant": {
      "type": "object",
      "additionalProperties": {
        "type": "array",
        "items": { "type": "string", "minLength": 1 }
      },
      "description": "variant_id -> evaluation_item_id[] present in the union of all variants' item_ids but absent from THIS variant's own item_ids. Empty object when identical_item_set is true."
    },
    "model_config_differences": {
      "type": "array",
      "items": {
        "type": "object",
        "additionalProperties": false,
        "required": ["variant_id", "model_config_id", "model_config_sha256"],
        "properties": {
          "variant_id": { "enum": ["STRUCTURED_FIRST", "HYBRID_RETRIEVAL", "PLANNER", "DOCUMENT_FIRST_RAG"] },
          "model_config_id": { "type": "string", "pattern": "^model_[a-z0-9_.-]+$" },
          "model_config_sha256": { "type": "string", "pattern": "^[0-9a-f]{64}$" }
        }
      },
      "description": "One entry per variant. When every entry shares the same model_config_sha256, model config was held fixed across the comparison (the intended default for an Agent-design-only comparison) -- a reader must check this array, not assume it."
    },
    "ranking_performed": { "const": false },
    "holdout_accessed": { "const": false },
    "official_gold_accessed": { "const": false }
  }
}
